{
  "schema_version": 2,
  "name": "overlay-reel",
  "version": 1,
  "size": [1920, 1080],
  "fps": 30,
  "budget_usd": 0,
  "never": [],
  "finish": {"grain": 0, "vignette": false, "texture": "none"},
  "music": {"file": "music/take1.mp3", "beat": 0.6, "first_hit": 0, "fade": 0.4},
  "segments": [
    {"name": "s01_shot", "secs": 3, "in": "cut", "push": 0, "source": {"still": "media/shot.jpg"}, "overlay": "o_marks"}
  ]
}
