{
 "schema_version": 2,
 "name": "dollars",
 "version": 1,
 "size": [
  1080,
  1920
 ],
 "fps": 30,
 "scene_lib": "explainer",
 "music": {
  "file": "music/take1.mp3",
  "beat": 0.5,
  "first_hit": 0,
  "fade": 0.3
 },
 "titles": {},
 "segments": [
  {
   "name": "s01_money",
   "secs": 4.0,
   "source": {
    "scene": "money"
   }
  }
 ]
}
