{
 "schema_version": 2,
 "name": "never",
 "version": 1,
 "size": [
  1080,
  1920
 ],
 "fps": 30,
 "scene_lib": "explainer",
 "music": {
  "file": "music/take1.mp3",
  "beat": 0.5,
  "first_hit": 0,
  "fade": 0.3
 },
 "titles": {},
 "segments": [
  {
   "name": "s00_page",
   "secs": 3.0,
   "source": {
    "shot": "home"
   }
  },
  {
   "name": "s01_home",
   "secs": 4.0,
   "source": {
    "scene": "endcard"
   }
  }
 ],
 "shots": {
  "home": {
   "url": "https://example.com/",
   "from": 0,
   "to": 600,
   "frames": 60
  }
 },
 "never": [
  "https://example.com"
 ]
}